agreement_id,vendor,scope,start_date,expiry_date,status,annual_cost,sla_response_time,sla_resolution_time,last_reviewed,next_review,notes
VMA-2025-001,Dell Technologies,Server hardware and SAN storage maintenance and break-fix support,2024-04-01,2026-03-31,Active,$125000,4 hours (Critical) / 8 hours (High),Next business day (Critical) / 3 business days (High),2025-01-15,2026-01-15,Covers all Dell PowerEdge servers and PowerStore SAN. Includes hardware replacement parts.
VMA-2025-002,Cisco Systems,Network switch and router maintenance and TAC support,2024-07-01,2026-06-30,Active,$85000,2 hours (P1) / 4 hours (P2),4 hours (P1) / Next business day (P2),2025-01-15,2026-01-15,SmartNet Total Care. Covers all Catalyst and Nexus switches.
VMA-2025-003,Fortinet,Firewall and IPS maintenance and FortiGuard subscriptions,2024-10-01,2025-09-30,Expired,$62000,4 hours / 8 hours,Next business day / 3 business days,2025-01-15,N/A,"AGREEMENT EXPIRED September 30, 2025. Renewal in progress — procurement negotiating new 3-year term. FortiGuard threat intelligence subscription still active (separate contract). Firewall hardware maintenance coverage has lapsed."
VMA-2025-004,VMware (Broadcom),vSphere and vCenter licensing and support,2024-01-01,2025-12-31,Active,$98000,4 hours / 8 hours,Next business day / 3 business days,2025-01-15,2026-01-15,Production Support. Includes all ESXi hosts and vCenter.
VMA-2025-005,Oracle,Database licensing and technical support,2024-06-01,2026-05-31,Active,$145000,Severity 1: 15 min / Severity 2: 2 hours,Varies by severity,2025-01-15,2026-01-15,Premier Support. Covers Oracle Database 19c.
VMA-2025-006,Schneider Electric,UPS and PDU maintenance,2024-03-01,2026-02-28,Active,$35000,4 hours (critical) / 24 hours (standard),Same day (critical) / 5 business days,2025-01-15,2026-01-15,Covers all Symmetra and Metered Rack PDUs.
VMA-2025-007,PaperCut,Print management software support,2024-09-01,2026-08-31,Active,$12000,24 hours,5 business days,2025-01-15,2026-01-15,PaperCut MF Standard Support.
VMA-2025-008,SAP,ERP application support,2023-01-01,2027-12-31,Active,$280000,Severity 1: 1 hour / Severity 2: 4 hours,Varies by severity and component,2025-01-15,2026-01-15,SAP Enterprise Support. Covers SAP ECC 6.0 EHP8.
