exception_id,policy_reference,requested_by,request_date,approved_by,approval_date,expiry_date,status,risk_level,description,compensating_controls,last_review_date,review_outcome,notes
EXC-2025-001,POL-ACC-003,DevOps Team,2025-01-20,Richard Tanaka (CISO),2025-01-25,2025-07-25,Expired — Remediated,Medium,"Shared service account for legacy monitoring system. MFA bypass required due to system limitations.","IP allowlisting to internal network only; Enhanced logging on service account; Weekly access review",2025-04-15,Controls effective — remediation in progress,"Remediated June 2025. Monitoring system upgraded to support individual service accounts with MFA."
EXC-2025-002,POL-ENC-002,Data Engineering,2025-02-10,Richard Tanaka (CISO),2025-02-15,2025-08-15,Expired — Renewed as EXC-2025-006,Medium,"Analytics pipeline uses HTTP between internal microservices within private VPC for performance.","VPC-only access; No PII in analytics payloads; Network monitoring enabled; Quarterly review",2025-05-15,Controls effective — renewal approved,"Renewed as EXC-2025-006. TLS implementation planned for Q1 2026 as part of service mesh rollout."
EXC-2025-003,POL-VUL-001,Platform Team,2025-03-05,Richard Tanaka (CISO),2025-03-10,2025-09-10,Expired — Renewed as EXC-2025-007,High,"Legacy payment gateway cannot be patched for CVE-2024-38812 due to vendor EOL.","Network isolation; WAF rules; Enhanced IDS monitoring; Vendor migration planned for Q4 2025",2025-06-10,Controls effective — vendor migration on track,"Renewed as EXC-2025-007. Vendor migration completed November 2025."
EXC-2025-004,POL-CHG-001,Engineering,2025-04-01,Richard Tanaka (CISO),2025-04-05,2025-10-05,Active,Low,"Emergency change bypass for critical production hotfixes during P1 incidents.","Post-hoc CAB review within 48 hours; CISO notification within 1 hour; Full documentation required",2025-07-05,Controls effective,Standard exception for incident response. Renewed annually.
EXC-2025-005,POL-ACC-003,QA Team,2025-05-15,Richard Tanaka (CISO),2025-05-20,2025-11-20,Active,Low,"Shared test accounts in staging environment for automated integration testing.","Staging environment isolated from production; No real customer data; Monthly credential rotation",2025-08-20,Controls effective,No production data exposure. Acceptable risk for testing efficiency.
EXC-2025-006,POL-ENC-002,Data Engineering,2025-08-10,Richard Tanaka (CISO),2025-08-15,2026-02-15,Active,Medium,"Renewal of EXC-2025-002. Analytics HTTP traffic within private VPC.","Same controls as EXC-2025-002; Service mesh POC started August 2025",2025-11-15,Controls effective,Service mesh deployment targeting Q1 2026.
EXC-2025-007,POL-VUL-001,Platform Team,2025-09-05,Richard Tanaka (CISO),2025-09-10,2026-03-10,Active,High,"Renewal of EXC-2025-003. Legacy payment gateway unpatched CVE.","Same controls plus migration to new vendor in progress",2025-11-05,Controls effective — migration complete Nov 2025,"Migration completed November 15, 2025. Exception can be closed at Q1 2026 review."
EXC-2025-008,POL-LOG-001,IT Operations,2025-06-20,ISGC (Q3 Async Review),2025-07-16,2026-01-16,Active,Medium,"Log retention reduced from 13 months to 6 months for non-production environments due to storage costs.","Production log retention unchanged at 13 months; Non-prod environments contain no customer data; Alerts still trigger on anomalies",2025-10-16,Controls effective,Approved by ISGC during Q3 async review. Cost savings of $45K/year.
