incident_id,severity,description,detected_at,triaged_at,contained_at,resolved_at,triage_minutes,containment_hours,resolution_hours,post_mortem_status,post_mortem_due,action_items_total,action_items_completed,assigned_ic,affected_sectors,notes
INC-2025-901,SEV-1,Kafka cluster compromise — unauthorized consumer group accessing customer data streams across multiple tenants,2025-10-11T05:20:00Z,2025-10-11T05:33:00Z,2025-10-11T06:10:00Z,2025-10-12T08:00:00Z,13,0.8,26.7,Complete,2025-10-15,7,5,Nathan Reeves,Financial + Healthcare,"Attacker created rogue consumer group using stolen Kafka credentials. Accessed real-time data streams for 4 financial and 2 healthcare customers. HIPAA and PCI notification required."
INC-2025-902,SEV-2,Unauthorized access to new GPU inference cluster — SSH key from pre-migration period still valid,2025-10-25T14:00:00Z,2025-10-25T14:22:00Z,2025-10-25T15:00:00Z,2025-10-26T10:00:00Z,22,1.0,20.0,Complete,2025-11-03,4,3,Nathan Reeves,N/A,"SSH key was from the legacy ML platform. Key migration process during the platform migration missed this key. Inference cluster deployed Aug 2025."
INC-2025-903,SEV-3,Anomalous data egress from new Flink processing cluster — investigation confirmed authorized replication to customer's backup endpoint,2025-11-05T09:30:00Z,2025-11-05T11:00:00Z,2025-11-05T12:00:00Z,2025-11-05T16:00:00Z,90,1.0,6.5,Not Required,N/A,0,0,Leah Winters,Retail,False alarm. Customer's automated backup was configured on the new Flink cluster without security team notification.
INC-2025-904,SEV-2,Data pipeline misconfiguration — healthcare customer data routed to retail customer's analytics dashboard for 23 minutes,2025-11-18T16:45:00Z,2025-11-18T17:02:00Z,2025-11-18T17:10:00Z,2025-11-19T14:00:00Z,17,0.4,21.25,Complete,2025-11-26,6,3,Nathan Reeves,Healthcare + Retail,"Cross-sector data leak. Healthcare patient data (de-identified but with re-identification risk) visible in retail customer dashboard. HIPAA notification filed. Root cause: tenant routing configuration error in new Kubernetes-based pipeline orchestrator deployed September 2025."
INC-2025-905,SEV-1,Ransomware on data ingestion gateway — Clop variant encrypted inbound data buffer,2025-12-02T01:45:00Z,2025-12-02T01:58:00Z,2025-12-02T02:30:00Z,2025-12-03T16:00:00Z,13,0.75,38.25,Complete,2025-12-08,8,3,Nathan Reeves,All sectors,"Data ingestion gateway processes streams for all customer sectors. Buffer contained ~4 hours of unprocessed data. Recovered from upstream replay. Entry vector: compromised container image in new K8s-based ingestion pipeline deployed October 2025."
INC-2025-906,SEV-2,Unauthorized access attempt on new Grafana monitoring dashboard — default admin credentials not changed after deployment,2025-12-09T11:00:00Z,2025-12-09T11:18:00Z,2025-12-09T11:30:00Z,2025-12-09T15:00:00Z,18,0.2,4.0,Complete,2025-12-16,3,3,Leah Winters,N/A,"Grafana deployed as part of new observability stack in November 2025. Default admin/admin credentials used for 3 weeks until external scanner found it. No data access — monitoring dashboards only."
INC-2025-907,SEV-4,Employee accessed customer analytics without business justification — DLP flagged,2025-12-15T10:00:00Z,2025-12-15T14:00:00Z,N/A,2025-12-15T16:00:00Z,240,N/A,6.0,Not Required,N/A,0,0,Leah Winters,N/A,Handled via HR. Read-only access to aggregate dashboards.
