incident_id,severity,description,detected_at,triaged_at,contained_at,resolved_at,triage_minutes,containment_hours,resolution_hours,post_mortem_status,post_mortem_due,action_items_total,action_items_completed,assigned_ic,customer_notification_sent,notification_timestamp,notes
INC-2025-701,SEV-1,Unauthorized API access to customer portfolio data — attacker used stolen OAuth refresh token to query portfolio positions for 34 institutional accounts,2025-10-14T03:20:00Z,2025-10-14T03:28:00Z,2025-10-14T03:55:00Z,2025-10-14T18:00:00Z,8,0.6,14.7,Complete,2025-10-17,6,6,Alex Drummond,Yes,2025-10-15T14:00:00Z,Breach confirmed Oct 14 at 06:00 UTC. Customers notified Oct 15 at 14:00 UTC (32 hours after confirmation). Within 48-hour SLA.
INC-2025-702,SEV-2,Compromised CI/CD pipeline — unauthorized code pushed to staging branch,2025-10-28T16:30:00Z,2025-10-28T16:48:00Z,2025-10-28T17:45:00Z,2025-10-29T12:00:00Z,18,1.3,19.5,Complete,2025-11-05,4,4,Alex Drummond,No,N/A,Staging only — no customer data exposure. Code change reviewed and reverted.
INC-2025-703,SEV-2,Anomalous database query pattern — single service account executed 12000 SELECT queries against trade_history table in 8 minutes,2025-11-08T22:15:00Z,2025-11-08T22:30:00Z,2025-11-08T23:00:00Z,2025-11-11T16:00:00Z,15,0.5,65.75,Complete,2025-11-18,5,3,Alex Drummond,Deferred — see notes,N/A,"Investigation began immediately. Service account belonged to authorized analytics pipeline but query volume was abnormal. Initial assessment: possible data scraping by compromised service account OR legitimate pipeline regression. By Nov 9 18:00 UTC (20 hours), forensics confirmed the service account credentials were not compromised — the analytics pipeline had a code bug causing query amplification. No data was exfiltrated. However, the IC deferred customer notification during the investigation. Notification decision was formally deferred at Nov 8 23:30 UTC. By Nov 9 18:00 UTC, confirmed as internal pipeline bug. No customer notification issued. Question: should customers have been notified of the suspected exposure even though investigation confirmed no breach?"
INC-2025-704,SEV-1,SQL injection via reporting API — attacker extracted trade execution data for 7 hedge fund clients,2025-11-20T14:10:00Z,2025-11-20T14:18:00Z,2025-11-20T14:40:00Z,2025-11-21T08:00:00Z,8,0.5,17.8,Complete,2025-11-26,8,5,Alex Drummond,Yes,2025-11-22T10:00:00Z,"Breach confirmed Nov 20 at 16:00 UTC. Customer notification sent Nov 22 at 10:00 UTC — 42 hours after confirmation. Within 48-hour SLA. SEC notification also filed. 7 hedge fund clients had trade execution data (timestamps, prices, volumes) exposed."
INC-2025-705,SEV-2,Unauthorized S3 bucket access — CloudTrail alert for GetObject calls from unrecognized IAM role on customer-reports bucket,2025-12-05T01:30:00Z,2025-12-05T01:48:00Z,2025-12-05T02:30:00Z,2025-12-08T14:00:00Z,18,1.0,84.5,Complete,2025-12-15,5,1,Alex Drummond,Deferred — see notes,N/A,"Contained within 1 hour (IAM role permissions revoked). Investigation to determine if report files were actually downloaded or if the API calls were reconnaissance. S3 server access logs showed 147 GetObject calls against the bucket but S3 access logs do not confirm whether files were fully downloaded (only that requests were made). By Dec 7 (48 hours), investigation still inconclusive — CloudTrail shows the API calls but VPC Flow Logs for the S3 endpoint show data transfer of 2.3 GB but cannot attribute it to the unauthorized role vs legitimate traffic. IC decided to continue investigating rather than notify customers. By Dec 8 at 14:00 UTC (84.5 hours after detection), forensic analysis concluded the 2.3 GB transfer was from the unauthorized role based on timing correlation. Customer notification was then sent Dec 9 at 09:00 UTC — 161 hours (6.7 days) after detection, and approximately 19 hours after breach was confirmed at Dec 8 14:00 UTC. Question: was the 84.5-hour investigation deferral appropriate, or should customers have been notified at the 72-hour mark per policy Section 4.2?"
INC-2025-706,SEV-3,Phishing campaign targeting trading desk analysts — 3 users reported suspicious emails,2025-12-12T09:00:00Z,2025-12-12T10:30:00Z,2025-12-12T11:00:00Z,2025-12-12T16:00:00Z,90,0.5,7.0,Not Required,N/A,0,0,Rachel Simmons,No,N/A,No credential compromise. Emails blocked by gateway. Users reported proactively.
INC-2025-707,SEV-4,Developer accessed production database directly for debugging — violation of access control policy,2025-12-18T14:00:00Z,2025-12-19T09:00:00Z,N/A,2025-12-19T11:00:00Z,1140,N/A,21.0,Not Required,N/A,0,0,Rachel Simmons,No,N/A,Handled via HR. Read-only access — no data modification.
